"Issue Name","Issue Type","Issue Priority","URLs","% of Total","Description","How To Fix"
"Images: Over 100 KB","Opportunity","Medium","16","35.560","Large images over a size threshold. Page speed is extremely important for users and SEO and often large resources such as images are one of the most common issues that slow down web pages. This filter simply acts as a general rule of thumb to help identify images that are fairly large in file size and may take longer to load. These should be considered for optimisation, alongside opportunities identified in the PageSpeed tab which uses the PSI API and Lighthouse to audit speed. This can help identify images that haven't been optimised in size, load offscreen, are unoptimised etc.","Uncompressed images bloat pages with unnecessary bytes, so ensure images are optimised with compression, properly scaled, and using the best image format to reduce file size where possible."
"Links: Internal Outlinks With No Anchor Text","Opportunity","Low","40","97.560","Pages that have internal links without anchor text or images that are hyperlinked without alt text. Anchor text is the visible text and words used in hyperlinks that provide users and search engines context about the content of the target page. Internal outlinks without anchor text can be seen in the 'Outlinks' tab, with the 'All Link Types' filter set to 'Hyperlinks', where the 'Anchor Text' column is blank, or if an image, the 'Alt Text' column is also blank. Export in bulk via 'Bulk Export > Links > Internal Outlinks With No Anchor Text'.","Review the missing anchor text outlinks and where appropriate include useful and descriptive anchor text to help users and search engines."
"Canonicals: Canonicalised","Warning","High","41","100.000","Pages that have a canonical to a different URL. The URL is 'canonicalised' to another location. This means the search engines are being instructed to not index the page, and the indexing and linking properties should be consolidated to the URL in the canonical.","These URLs should be reviewed carefully to ensure the indexing and link signals are being consolidated to the correct URL. In a perfect world, a website wouldn't need to canonicalise any URLs as only canonical versions would be linked to internally on a website, but often they are required due to various circumstances outside of control, and to prevent duplicate content. Update internal links to canonical versions of URLs where possible."
"Directives: Noindex","Warning","High","8","6.960","URLs containing a 'noindex' directive in either a robots meta tag or X-Robots-Tag in the HTTP header. This instructs the search engines not to index the page. The page will still be crawled (to see the directive), but it will then be dropped from the index.","URLs with a 'noindex' should be reviewed carefully to ensure they are correct and shouldn't be indexed. If these pages should be indexed, then the 'noindex' directive should be removed."
"Response Codes: Internal Client Error (4xx)","Issue","High","2","1.570","Internal URLs with a client-side error. This indicates a problem occurred with the URL request and can include responses such as 400 bad request, 403 Forbidden, 404 Page Not Found, 410 Removed, 429 Too Many Requests and more. A 404 'Page Not Found' is the most common, and often referred to as a broken link. View URLs that link to errors using the lower 'inlinks' tab and export them in bulk via 'Bulk Export > Response Codes > Internal > Client Error (4xx) inlinks'.","All links on a website should ideally resolve to 200 'OK' URLs. Errors such as a 404 or 410 should be updated to their correct locations, removed and redirected where appropriate. A 403 forbidden error occurs when a web server denies access to the SEO Spider's request and can often be resolved by switching the user-agent to Chrome via 'Config > User-Agent' and crawling again."
"Images: Missing Size Attributes","Opportunity","Low","42","93.330","Image elements without dimensions (width and height size attributes) specified in the HTML. This can cause large layout shifts as the page loads and be frustrating experience for users. It is one of the major reasons that contributes to a high Cumulative Layout Shift (CLS).","Define all image sizes as their native size using width and height attributes in the HTML. This allows the browser to calculate enough space for each image before it loads, avoiding large layout shifts."
"Response Codes: External Client Error (4xx)","Warning","Low","6","4.720","External URLs with a client-side error. This indicates a problem occurred with the URL request and can include responses such as 400 bad request, 403 Forbidden, 404 Page Not Found, 410 Removed, 429 Too Many Requests and more. A 404 'Page Not Found' is the most common, and often referred to as a broken link. View URLs that link to errors using the lower 'inlinks' tab and export them in bulk via 'Bulk Export > Response Codes > External > Client Error (4xx) inlinks'.","All links on a website should ideally resolve to 200 'OK' URLs. Errors such as 404 broken links should be updated so users are taken to the correct URL, or removed. A 403 forbidden error occurs when a web server denies access to the SEO Spider's request and can often be resolved by switching the user-agent to Chrome via 'Config > User-Agent'. If they can be viewed in a browser, then it's often not an issue."
"Canonicals: Non-Indexable Canonical","Issue","High","30","73.170","Pages with a canonical URL that is non-indexable. This will include canonicals which are blocked by robots.txt, no response, redirect (3XX), client error (4XX), server error (5XX), are 'noindex' or 'canonicalised' themselves. This means the search engines are being instructed to consolidate indexing and link signals to a non-indexable page, which often leads to them ignoring the canonical, but may also lead to unpredictability in indexing and ranking. Export pages, their canonicals and status codes via 'Reports > Canonicals > Non-Indexable Canonicals'.","Ensure canonical URLs are to accurate indexable pages to avoid them being ignored by search engines, and any potential indexing or ranking unpredictability."
